<?xml version="1.0"?>
<!DOCTYPE source SYSTEM "source.dtd">
<source>
    <name>Pinterest</name>
    <keys>
        <key>
            <name>Access token</name>
            <value>access_token</value>
        </key>
    </keys>
    <children>
        <node>
            <name>User</name>
            <function>user</function>
            <inputs>
                <input>
                    <name>Username</name>
                    <type>primary</type>
                </input>
                <input>
                    <name>Fields</name>
                    <type>list</type>
                    <elems>
                        <elem>id</elem>
                        <elem>username</elem>
                        <elem>first_name</elem>
                        <elem>last_name</elem>
                        <elem>bio</elem>
                        <elem>created_at</elem>
                        <elem>counts</elem>
                        <elem>image</elem>
                    </elems>
                </input>
            </inputs>
            <children>
                <node>
                    <name>Boards</name>
                    <function>user_boards</function>
                    <inputs>
                        <input>
                            <name>User</name>
                            <type>primary</type>
                        </input>
                        <input>
                            <name>Fields</name>
                            <type>list</type>
                            <elems>
                                <elem>id</elem>
                                <elem>name</elem>
                                <elem>url</elem>
                                <elem>description</elem>
                                <elem>creator</elem>
                                <elem>created_at</elem>
                                <elem>counts</elem>
                                <elem>image</elem>
                            </elems>
                        </input>
                    </inputs>
                    <children/>
                </node>
                <node>
                    <name>Pins</name>
                    <function>user_pins</function>
                    <inputs>
                        <input>
                            <name>User</name>
                            <type>primary</type>
                        </input>
                        <input>
                            <name>Fields</name>
                            <type>list</type>
                            <elems>
                                <elem>id</elem>
                                <elem>link</elem>
                                <elem>url</elem>
                                <elem>creator</elem>
                                <elem>board</elem>
                                <elem>created_at</elem>
                                <elem>note</elem>
                                <elem>color</elem>
                                <elem>counts</elem>
                                <elem>media</elem>
                                <elem>attribution</elem>
                                <elem>image</elem>
                                <elem>metadata</elem>
                            </elems>
                        </input>
                    </inputs>
                    <children/>
                </node>
            </children>
        </node>
        <node>
            <name>Board</name>
            <function>board</function>
            <inputs>
                <input>
                    <name>User</name>
                    <type>primary</type>
                </input>
                <input>
                    <name>Board</name>
                    <type>primary</type>
                </input>
                <input>
                    <name>Fields</name>
                    <type>list</type>
                    <elems>
                        <elem>id</elem>
                        <elem>name</elem>
                        <elem>url</elem>
                        <elem>description</elem>
                        <elem>creator</elem>
                        <elem>created_at</elem>
                        <elem>counts</elem>
                        <elem>image</elem>
                    </elems>
                </input>
            </inputs>
            <children>
                <node>
                    <name>Pins</name>
                    <function>board_pins</function>
                    <inputs>
                        <input>
                            <name>User</name>
                            <type>primary</type>
                        </input>
                        <input>
                            <name>Board</name>
                            <type>primary</type>
                        </input>
                        <input>
                            <name>Fields</name>
                            <type>list</type>
                            <elems>
                                <elem>id</elem>
                                <elem>link</elem>
                                <elem>url</elem>
                                <elem>creator</elem>
                                <elem>board</elem>
                                <elem>created_at</elem>
                                <elem>note</elem>
                                <elem>color</elem>
                                <elem>counts</elem>
                                <elem>media</elem>
                                <elem>attribution</elem>
                                <elem>image</elem>
                                <elem>metadata</elem>
                            </elems>
                        </input>
                    </inputs>
                    <children/>
                </node>
            </children>
        </node>
        <node>
            <name>Pin</name>
            <function>pin</function>
            <inputs>
                <input>
                    <name>Pin</name>
                    <type>primary</type>
                </input>
                <input>
                    <name>Fields</name>
                    <type>list</type>
                    <elems>
                        <elem>id</elem>
                        <elem>link</elem>
                        <elem>url</elem>
                        <elem>creator</elem>
                        <elem>board</elem>
                        <elem>created_at</elem>
                        <elem>note</elem>
                        <elem>color</elem>
                        <elem>counts</elem>
                        <elem>media</elem>
                        <elem>attribution</elem>
                        <elem>image</elem>
                        <elem>metadata</elem>
                    </elems>
                </input>
            </inputs>
            <children/>
        </node>
    </children>
</source>