<?xml version="1.0"?>
<!DOCTYPE source SYSTEM "source.dtd">
<source>
    <name>Reddit</name>
    <keys>
        <key>
            <name>Application id</name>
            <value>application_id</value>
        </key>
        <key>
            <name>Application secret</name>
            <value>application_secret</value>
        </key>
    </keys>
    <children>
        <node>
            <name>Search</name>
            <function>search</function>
            <description>Search's Threads</description>
            <inputs>
                <input required="true">
                    <name>Query</name>
                    <type>primary</type>
                </input>
                <input>
                    <name>Arguments</name>
                    <type>arguments</type>
                    <columns>
                        <column>Argument</column>
                        <column>Value</column>
                    </columns>
                    <setters>
                        <setter>
                            <name>Order</name>
                            <argument>order</argument>
                            <value>top,new,relevance,comments</value>
                            <type>list</type>
                        </setter>
                        <setter>
                            <name>Thread count</name>
                            <argument>count</argument>
                            <value>1000</value>
                            <type>counter</type>
                        </setter>
                        <setter>
                            <name>Time period</name>
                            <argument>time_period</argument>
                            <value>all,year,month,week,today,hour</value>
                            <type>list</type>
                        </setter>
                    </setters>
                </input>
            </inputs>
            <children/>
        </node>
        <node>
            <name>Subreddit</name>
            <function>subreddit</function>
            <description>Subreddit's Threads</description>
            <inputs>
                <input required="true">
                    <name>Subreddit</name>
                    <type>primary</type>
                </input>
                <input>
                    <name>Arguments</name>
                    <type>arguments</type>
                    <columns>
                        <column>Argument</column>
                        <column>Value</column>
                    </columns>
                    <setters>
                        <setter>
                            <name>Category</name>
                            <argument>category</argument>
                            <value>top,new,hot,rising,controversial</value>
                            <type>list</type>
                        </setter>
                        <setter>
                            <name>Thread count</name>
                            <argument>count</argument>
                            <value>1000</value>
                            <type>counter</type>
                        </setter>
                        <setter>
                            <name>Time period</name>
                            <argument>time_period</argument>
                            <value>all,year,month,week,today,hour</value>
                            <type>list</type>
                        </setter>
                    </setters>
                </input>
            </inputs>
            <children/>
        </node>
        <node>
            <name>User</name>
            <function>user</function>
            <description>User's Threads and Comments</description>
            <inputs>
                <input required="true">
                    <name>User</name>
                    <type>primary</type>
                </input>
                <input>
                    <name>Arguments</name>
                    <type>arguments</type>
                    <columns>
                        <column>Argument</column>
                        <column>Value</column>
                    </columns>
                    <setters>
                        <setter>
                            <name>Result type</name>
                            <argument>result_type</argument>
                            <value>overview,submitted,comments,guilded</value>
                            <type>list</type>
                        </setter>
                        <setter>
                            <name>Result count</name>
                            <argument>count</argument>
                            <value>1000</value>
                            <type>counter</type>
                        </setter>
                        <setter>
                            <name>Order</name>
                            <argument>time_period</argument>
                            <value>new,hot,top,controversial</value>
                            <type>list</type>
                        </setter>
                    </setters>
                </input>
            </inputs>
            <children/>
        </node>
        <node>
            <name>Thread</name>
            <function>thread</function>
            <inputs>
                <input required="true">
                    <name>Thread id</name>
                    <type>primary</type>
                </input>
                <input required="true">
                    <name>Subreddit</name>
                    <type>primary</type>
                </input>
                <input>
                    <name>Arguments</name>
                    <type>arguments</type>
                    <columns>
                        <column>Argument</column>
                        <column>Value</column>
                    </columns>
                </input>
            </inputs>
            <children>
                <node>
                    <name>Comments</name>
                    <function>thread_comments</function>
                    <inputs>
                        <input required="true">
                            <name>Thread id</name>
                            <type>primary</type>
                        </input>
                        <input required="true">
                            <name>Subreddit</name>
                            <type>primary</type>
                        </input>
                        <input>
                            <name>Arguments</name>
                            <type>arguments</type>
                            <columns>
                                <column>Argument</column>
                                <column>Value</column>
                            </columns>
                            <setters>
                                <setter>
                                    <name>Comment count</name>
                                    <argument>count</argument>
                                    <value>500</value>
                                    <type>counter</type>
                                </setter>
                                <setter>
                                    <name>Comment order</name>
                                    <argument>order</argument>
                                    <value>top,new,best,controversial,old,q&amp;a</value>
                                    <type>list</type>
                                </setter>
                            </setters>
                        </input>
                    </inputs>
                    <children></children>
                </node>
            </children>
        </node>
    </children>
</source>